[
  {
    "slug": "gold-ownership-2",
    "href": "https://indexecoresort.com/gold-ownership-2",
    "name": "Gold Ownership",
    "hero": {
      "title": "Gold Ownership",
      "image": {
        "src": "https://indexecoresort.com/public/storage/images/admin/ownership/NgpuS2FyTMfKRKVFyDxm8gTZI9YLEXW99DK6XnRC.jpg",
        "alt": ""
      },
      "breadcrumb": {
        "home": {
          "label": "Home",
          "href": "#"
        },
        "current": "Gold Ownership"
      }
    },
    "heading": "💳 Silver Ownership: 5 Shares",
    "discountText": "10% discount on purchasing 5 (five) shares in cash",
    "cta": {
      "label": "Book Your Share",
      "href": "#"
    },
    "card": {
      "src": "https://indexecoresort.com/public/storage/images/admin/ownership/M7PT7o7U1pZ5zoj8HTmLOVBm2qSR1YEKJwXq4R30.jpg",
      "alt": "Membership Card"
    },
    "benefitsTitle": "Ownership Benefits",
    "benefits": [
      "Luxurious Suite",
      "Great recognition in upward society",
      "Lifetime Opportunity to enjoy",
      "Exclusive stay per year with family",
      "Ownership will be transferred by Registered Deed",
      "Best Passive Income Model",
      "Lifetime halal income",
      "Guaranteed return from the investment",
      "This ownership is transferable"
    ],
    "youtubeId": "nftc2Vk4o_A",
    "youtubeSrc": "https://www.youtube.com/embed/nftc2Vk4o_A",
    "plans": {
      "eyebrow": "Ownership Packages",
      "title": "Choose Your Plan",
      "packages": [
        {
          "name": "Silver Ownership",
          "href": "https://indexecoresort.com/silver-ownership-5",
          "slug": "silver-ownership-5",
          "card": {
            "src": "https://indexecoresort.com/public/storage/images/admin/ownership/wnYWaDS70Mshli7g6GPTxYHttxa5kEUqbMSP7rnd.jpg",
            "alt": "Royalty Ownership Card"
          }
        },
        {
          "name": "Signature Ownership",
          "href": "https://indexecoresort.com/signature-ownership-4",
          "slug": "signature-ownership-4",
          "card": {
            "src": "https://indexecoresort.com/public/storage/images/admin/ownership/SWhyRod6BC1gK8NW385qLcuk70iiDFVXS1e9rx3n.jpg",
            "alt": "Royalty Ownership Card"
          }
        },
        {
          "name": "Platinum Ownership",
          "href": "https://indexecoresort.com/platinum-ownership-3",
          "slug": "platinum-ownership-3",
          "card": {
            "src": "https://indexecoresort.com/public/storage/images/admin/ownership/RYz9DmgQsZyQ0yEYFvkShtsddBkg8UPUk8Cg34AP.jpg",
            "alt": "Royalty Ownership Card"
          }
        },
        {
          "name": "Gold Ownership",
          "href": "https://indexecoresort.com/gold-ownership-2",
          "slug": "gold-ownership-2",
          "card": {
            "src": "https://indexecoresort.com/public/storage/images/admin/ownership/M7PT7o7U1pZ5zoj8HTmLOVBm2qSR1YEKJwXq4R30.jpg",
            "alt": "Royalty Ownership Card"
          }
        }
      ]
    }
  },
  {
    "slug": "platinum-ownership-3",
    "href": "https://indexecoresort.com/platinum-ownership-3",
    "name": "Platinum Ownership",
    "hero": {
      "title": "Platinum Ownership",
      "image": {
        "src": "https://indexecoresort.com/public/storage/images/admin/ownership/3Fr43BrL4RgWR5l5NxxHai7OXmLhDtQRUAUf4HSn.jpg",
        "alt": ""
      },
      "breadcrumb": {
        "home": {
          "label": "Home",
          "href": "#"
        },
        "current": "Platinum Ownership"
      }
    },
    "heading": "💳 Silver Ownership: 10 Shares",
    "discountText": "12% discount on purchasing 10 (ten) shares in cash",
    "cta": {
      "label": "Book Your Share",
      "href": "#"
    },
    "card": {
      "src": "https://indexecoresort.com/public/storage/images/admin/ownership/RYz9DmgQsZyQ0yEYFvkShtsddBkg8UPUk8Cg34AP.jpg",
      "alt": "Membership Card"
    },
    "benefitsTitle": "Ownership Benefits",
    "benefits": [
      "Luxurious Suite",
      "Great recognition in upward society",
      "Lifetime Opportunity to enjoy",
      "Exclusive stay per year with family",
      "Ownership will be transferred by Registered Deed",
      "Best Passive Income Model",
      "Lifetime halal income",
      "Guaranteed return from the investment",
      "This ownership is transferable"
    ],
    "youtubeId": "_iY6MareB_M",
    "youtubeSrc": "https://www.youtube.com/embed/_iY6MareB_M",
    "plans": {
      "eyebrow": "Ownership Packages",
      "title": "Choose Your Plan",
      "packages": [
        {
          "name": "Silver Ownership",
          "href": "https://indexecoresort.com/silver-ownership-5",
          "slug": "silver-ownership-5",
          "card": {
            "src": "https://indexecoresort.com/public/storage/images/admin/ownership/wnYWaDS70Mshli7g6GPTxYHttxa5kEUqbMSP7rnd.jpg",
            "alt": "Royalty Ownership Card"
          }
        },
        {
          "name": "Signature Ownership",
          "href": "https://indexecoresort.com/signature-ownership-4",
          "slug": "signature-ownership-4",
          "card": {
            "src": "https://indexecoresort.com/public/storage/images/admin/ownership/SWhyRod6BC1gK8NW385qLcuk70iiDFVXS1e9rx3n.jpg",
            "alt": "Royalty Ownership Card"
          }
        },
        {
          "name": "Platinum Ownership",
          "href": "https://indexecoresort.com/platinum-ownership-3",
          "slug": "platinum-ownership-3",
          "card": {
            "src": "https://indexecoresort.com/public/storage/images/admin/ownership/RYz9DmgQsZyQ0yEYFvkShtsddBkg8UPUk8Cg34AP.jpg",
            "alt": "Royalty Ownership Card"
          }
        },
        {
          "name": "Gold Ownership",
          "href": "https://indexecoresort.com/gold-ownership-2",
          "slug": "gold-ownership-2",
          "card": {
            "src": "https://indexecoresort.com/public/storage/images/admin/ownership/M7PT7o7U1pZ5zoj8HTmLOVBm2qSR1YEKJwXq4R30.jpg",
            "alt": "Royalty Ownership Card"
          }
        }
      ]
    }
  },
  {
    "slug": "signature-ownership-4",
    "href": "https://indexecoresort.com/signature-ownership-4",
    "name": "Signature Ownership",
    "hero": {
      "title": "Signature Ownership",
      "image": {
        "src": "https://indexecoresort.com/public/storage/images/admin/ownership/U3ki7ybjxwzqAOPLsnBNWRdAnh69l4saRySz53Uq.jpg",
        "alt": ""
      },
      "breadcrumb": {
        "home": {
          "label": "Home",
          "href": "#"
        },
        "current": "Signature Ownership"
      }
    },
    "heading": "💳 Silver Ownership: 20 Shares",
    "discountText": "15% discount on purchasing 20 (twenty) shares in cash",
    "cta": {
      "label": "Book Your Share",
      "href": "#"
    },
    "card": {
      "src": "https://indexecoresort.com/public/storage/images/admin/ownership/SWhyRod6BC1gK8NW385qLcuk70iiDFVXS1e9rx3n.jpg",
      "alt": "Membership Card"
    },
    "benefitsTitle": "Ownership Benefits",
    "benefits": [
      "Luxurious Suite",
      "Great recognition in upward society",
      "Lifetime Opportunity to enjoy",
      "Exclusive stay per year with family",
      "Ownership will be transferred by Registered Deed",
      "Best Passive Income Model",
      "Lifetime halal income",
      "Guaranteed return from the investment",
      "This ownership is transferable"
    ],
    "youtubeId": "nftc2Vk4o_A",
    "youtubeSrc": "https://www.youtube.com/embed/nftc2Vk4o_A",
    "plans": {
      "eyebrow": "Ownership Packages",
      "title": "Choose Your Plan",
      "packages": [
        {
          "name": "Silver Ownership",
          "href": "https://indexecoresort.com/silver-ownership-5",
          "slug": "silver-ownership-5",
          "card": {
            "src": "https://indexecoresort.com/public/storage/images/admin/ownership/wnYWaDS70Mshli7g6GPTxYHttxa5kEUqbMSP7rnd.jpg",
            "alt": "Royalty Ownership Card"
          }
        },
        {
          "name": "Signature Ownership",
          "href": "https://indexecoresort.com/signature-ownership-4",
          "slug": "signature-ownership-4",
          "card": {
            "src": "https://indexecoresort.com/public/storage/images/admin/ownership/SWhyRod6BC1gK8NW385qLcuk70iiDFVXS1e9rx3n.jpg",
            "alt": "Royalty Ownership Card"
          }
        },
        {
          "name": "Platinum Ownership",
          "href": "https://indexecoresort.com/platinum-ownership-3",
          "slug": "platinum-ownership-3",
          "card": {
            "src": "https://indexecoresort.com/public/storage/images/admin/ownership/RYz9DmgQsZyQ0yEYFvkShtsddBkg8UPUk8Cg34AP.jpg",
            "alt": "Royalty Ownership Card"
          }
        },
        {
          "name": "Gold Ownership",
          "href": "https://indexecoresort.com/gold-ownership-2",
          "slug": "gold-ownership-2",
          "card": {
            "src": "https://indexecoresort.com/public/storage/images/admin/ownership/M7PT7o7U1pZ5zoj8HTmLOVBm2qSR1YEKJwXq4R30.jpg",
            "alt": "Royalty Ownership Card"
          }
        }
      ]
    }
  },
  {
    "slug": "silver-ownership-5",
    "href": "https://indexecoresort.com/silver-ownership-5",
    "name": "Silver Ownership",
    "hero": {
      "title": "Silver Ownership",
      "image": {
        "src": "https://indexecoresort.com/public/storage/images/admin/ownership/PYWTVMFnxbKL56Lyeos45BMc6Pgl6QfRNzICohTd.jpg",
        "alt": ""
      },
      "breadcrumb": {
        "home": {
          "label": "Home",
          "href": "#"
        },
        "current": "Silver Ownership"
      }
    },
    "heading": "💳 Silver Ownership: 3 Shares",
    "discountText": "7% discount on purchasing 3 (three) shares in cash",
    "cta": {
      "label": "Book Your Share",
      "href": "#"
    },
    "card": {
      "src": "https://indexecoresort.com/public/storage/images/admin/ownership/wnYWaDS70Mshli7g6GPTxYHttxa5kEUqbMSP7rnd.jpg",
      "alt": "Membership Card"